### ISSUE TITLE
Not working on Macos

### ISSUE THREAD

**Issue by chrism9876** [JamesDunne/lancaster-go#2]
This is working perfectly on linux but not on MacOS.

I dont believe its the network as ive i ping the multicast address 224.0.0.100 i can see pings on all macs with tcpdump open.

Same with VLC i can Stream and receive UDP streams on address 224.0.0.100

I have also analysed traffic on the same mac when serving to loopback interface with loopback enabled no traffic appears

**Comment by chrism9876** [comment]
I am using the -k option with should set address to 224.0.0.100 as documentation suggests but i can still see traffic on 239.0.0.100:1361

15:04:41.636025 IP 127.0.0.1.1361 > 239.0.0.100.1361: UDP, length 10
15:04:42.635852 IP 127.0.0.1.1361 > 239.0.0.100.1361: UDP, length 10
15:04:43.635951 IP 127.0.0.1.1361 > 239.0.0.100.1361: UDP, length 10
15:04:44.635944 IP 127.0.0.1.1361 > 239.0.0.100.1361: UDP, length 10

**Comment by chrism9876** [comment]
It seems be backwards not using the -k option uses 224.0.0.100
When Mac 1 is serving files mac 2 can see the udp traffic on 224.0.0.100 and visa versa

But when downloading only the mac thats downloading can see these messages the other cant
15:18:19.357216 IP 172.27.170.38 > 224.0.0.100: igmp v2 report 224.0.0.100
